[
  {
    "id": "loumilis-ii",
    "tier": "B",
    "score": 8.6,
    "name": "Loumilis II",
    "year": 2019,
    "model": "Lagoon 450F",
    "location": "Placencia, Belize",
    "ask_display": "€350,000 excl. VAT",
    "ask_currency": "EUR",
    "ask_value": 350000.0,
    "why": "Young 2019 Lagoon 450F in the Caribbean with generator, A/C, watermaker and a 2kW Mastervolt inverter. Dream/Navigare confirms its Lagoon 450s received bulkhead repair, and this boat is available now.",
    "risks": "Fresh broker facts: about 3,000h engines and about 3,000h generator, but original standing rigging and sails, acid batteries and no solar. Ex-charter; saildrive, phase-out and casualty history remain survey items.",
    "refit_display": "$65–95k planning range",
    "refit_low": 95000.0,
    "refit_high": 95000.0,
    "all_in_display": "~€415–445k plus VAT/tax/survey/closing; more if saildrives or genset findings expand",
    "all_in_low": 445000.0,
    "all_in_high": 445000.0,
    "stage": "Diligence active",
    "stage_bucket": "diligence",
    "contact": "Gerry Jacob / Dream Yacht & Navigare",
    "contact_channel": "gerry.jacob@dreamyachtcharter.com",
    "last_activity": "2026-09-03",
    "next_step": "No further outreach needed now. Price full rig and sails plus lithium, solar and charging; require phase-out file and saildrive history before considering an offer. Its 2019 age helps, but all-in economics are no longer exceptional at ask.",
    "listing_url": "https://www.dreamyachtsales.com/pre-owned-yachts/lagoon-450/",
    "notes": "9/3 hard facts: engines about 3,000h; genset about 3,000h; acid batteries; original rig and sails; no solar; Mastervolt 12/2000; available now.",
    "latest_email_thread": "Open latest thread",
    "last_heard_from": "2026-09-03",
    "last_reached_out": "2026-09-03"
  },
  {
    "id": "le-lavandou-lagoon-450f",
    "tier": "A",
    "score": 9.0,
    "name": "Le Lavandou Lagoon 450F",
    "year": 2019,
    "model": "Lagoon 450F",
    "location": "Le Lavandou, France",
    "ask_display": "€295,000 excl. VAT",
    "ask_currency": "EUR",
    "ask_value": 295000.0,
    "why": "Exceptionally young 450F at €295k; 4-cabin/4-head, twin 57hp Yanmars and some solar. One of the strongest headline age/price anomalies in the Mediterranean.",
    "risks": "~6,000 engine hours and almost no public refit detail. Need charter history, Lagoon structural status, rig/sails, genset, saildrives, moisture/casualty history and actual solar/electrical capacity.",
    "refit_display": "$35–75k",
    "refit_low": 75000.0,
    "refit_high": 75000.0,
    "all_in_display": "~$385–430k equivalent + VAT/tax as applicable",
    "all_in_low": 430000.0,
    "all_in_high": 430000.0,
    "stage": "Outreach sent — awaiting reply",
    "stage_bucket": "waiting",
    "contact": "Anthony Cegri / CAP MED",
    "contact_channel": "anthony@cap-med.net",
    "last_activity": "2026-09-02",
    "next_step": "Get survey, structural docs, mechanical records, rig/sails, systems spec and first-24-month capex; understand why price is so low.",
    "listing_url": "https://www.yachtworld.com/yacht/2019-lagoon-450-f-9615453/",
    "notes": "NEW: headline price is strong enough to investigate despite 6k hours.",
    "latest_email_thread": "Open latest thread",
    "last_heard_from": "—",
    "last_reached_out": "2026-09-02"
  },
  {
    "id": "wanderer",
    "tier": "D",
    "score": 9.8,
    "name": "WANDERER",
    "year": 2020,
    "model": "Lagoon 42",
    "location": "Tortola / Sea Cows Bay, BVI",
    "ask_display": "$299,000",
    "ask_currency": "USD",
    "ask_value": 299000.0,
    "why": "Exceptional 2020 Lagoon 42 fleet-exit pricing with low engine hours and useful charter systems; a benchmark for true mispricing.",
    "risks": "Acceptance is signed and broker expects transaction to close, so it is no longer an actionable top candidate.",
    "refit_display": "$25–50k if it returns",
    "refit_low": 50000.0,
    "refit_high": 50000.0,
    "all_in_display": "~$325–350k + survey/closing",
    "all_in_low": 350000.0,
    "all_in_high": 350000.0,
    "stage": "Under contract / backup only",
    "stage_bucket": "closed",
    "contact": "Chesnee Cogswell",
    "contact_channel": "chesnee@bviyachtsales.com",
    "last_activity": "2026-09-02",
    "next_step": "Do not chase unless broker says deal fails; preserve as a comp and reminder that real bargains move immediately.",
    "listing_url": "https://www.yachtworld.com/yacht/2020-lagoon-42-10200099/",
    "notes": "ARCHIVED FROM ACTIVE RANKING; broker saw heavy interest and expects closing.",
    "latest_email_thread": "Open latest thread",
    "last_heard_from": "2026-09-02",
    "last_reached_out": "2026-09-02"
  },
  {
    "id": "larimar",
    "tier": "D",
    "score": 9.4,
    "name": "Larimar",
    "year": 2016,
    "model": "Lagoon 400 S2",
    "location": "Grenada",
    "ask_display": "$265,000",
    "ask_currency": "USD",
    "ask_value": 265000.0,
    "why": "Strong 2016+ price benchmark; reasonable hours and Lagoon water-tank shelf remediation completed March 2026.",
    "risks": "Already has an offer; survey next week and sea trial the following week.",
    "refit_display": "$20–45k if it returns",
    "refit_low": 45000.0,
    "refit_high": 45000.0,
    "all_in_display": "~$285–310k + survey/closing",
    "all_in_low": 310000.0,
    "all_in_high": 310000.0,
    "stage": "Under offer / backup only",
    "stage_bucket": "closed",
    "contact": "Gary Haynes",
    "contact_channel": "gary@horizongrenada.com",
    "last_activity": "2026-09-02",
    "next_step": "Wait for broker update week commencing Sept. 21; move quickly if current buyer walks.",
    "listing_url": "https://www.yachtworld.com/yacht/2016-lagoon-400-s2-9308694/",
    "notes": "ARCHIVED FROM ACTIVE RANKING until current offer resolves.",
    "latest_email_thread": "Open latest thread",
    "last_heard_from": "2026-09-02",
    "last_reached_out": "2026-09-02"
  },
  {
    "id": "netboat-lagoon-40",
    "tier": "D",
    "score": 8.8,
    "name": "NetBoat Lagoon 40",
    "year": 2018,
    "model": "Lagoon 40",
    "location": "Le Marin, Martinique",
    "ask_display": "~€250k lane",
    "ask_currency": "EUR",
    "ask_value": 250.0,
    "why": "Aggressive newer-Lagoon price benchmark and a useful broker relationship for similar/off-market inventory.",
    "risks": "Sold before diligence could proceed.",
    "refit_display": "—",
    "refit_low": null,
    "refit_high": null,
    "all_in_display": "—",
    "all_in_low": null,
    "all_in_high": null,
    "stage": "Sold / withdrawn",
    "stage_bucket": "closed",
    "contact": "Carla Bianchini / NetBoat",
    "contact_channel": "carla@net-boat.com",
    "last_activity": "2026-09-02",
    "next_step": "Broker now has our complete criteria and will source similar/off-market boats.",
    "listing_url": "https://www.net-boat.com/",
    "notes": "Preserved as search history rather than deleted.",
    "latest_email_thread": "Open latest thread",
    "last_heard_from": "2026-09-02",
    "last_reached_out": "2026-09-02"
  },
  {
    "id": "macera",
    "tier": "A",
    "score": 9.6,
    "name": "MACERA",
    "year": 2008,
    "model": "Privilege 495 Owner’s Version",
    "location": "Narganá / San Blas, Panama",
    "ask_display": "$390,000 tax not paid",
    "ask_currency": "USD",
    "ask_value": 390000.0,
    "why": "Private/never-chartered claim plus unusually document-backed ~$200k refit: Todomar engine rebuild records, French Marine replacement SD60 paperwork, US Spars 2022 standing-rig records, and a newly delivered consolidated maintenance/refit history with supporting-document register. ~2,435W solar, 1,200Ah lithium, 9.5kW Mase genset, twin watermakers, radar/AIS/Starlink/Iridium, washer and owner layout.",
    "risks": "49-ft TCO; original Hydranet sails; owner-built 1,200Ah lithium with insurance/electrical-acceptance questions; dolphin striker was not replaced; 4/5 A/C work; trampolines need replacement; port-hull coating adhesion repair is a known item; tax not paid. The new owner documentation improves provenance but does not replace an independent survey of historic underwater/blister/grounding and current coating/structure issues.",
    "refit_display": "$20–40k + larger 49-ft reserve",
    "refit_low": 40000.0,
    "refit_high": 40000.0,
    "all_in_display": "~$410–435k before tax/import + survey/closing",
    "all_in_low": 435000.0,
    "all_in_high": 435000.0,
    "stage": "Consolidated owner/refit documentation received — decision gate",
    "stage_bucket": "max_decision",
    "contact": "Adrian Nicolle",
    "contact_channel": "adrian.nicolle@nicolle-associates.com",
    "last_activity": "2026-09-03",
    "next_step": "YOUR DECISION after digesting Adrian's consolidated refit/history package: whether MACERA merits an exploratory offer strictly subject to viewing/survey. No offer or travel discussion initiated automatically.",
    "listing_url": "https://www.multihullcompany.com/boat/privilege-495-10284986/",
    "notes": "Actual displays: ~4,082h port / 3,341h starboard; owner estimates ~1,000h and ~500h since rebuild; Mase genset ~2,836h. Adrian's latest package says it consolidates 2022 rigging/chainplate information, 2025 engine/injector/turbo work, generator service, lithium installation, prior grounding/underwater history, historic blister repairs, hatch leaks, watermakers, sails/navigation and the port-hull coating issue. Treat these as documented diligence inputs, not survey conclusions.",
    "latest_email_thread": "Open latest thread",
    "last_heard_from": "2026-09-03",
    "last_reached_out": "2026-09-02"
  },
  {
    "id": "nadi",
    "tier": "A",
    "score": 9.5,
    "name": "NADI",
    "year": 2010,
    "model": "Knysna 480",
    "location": "Riviera Beach, FL",
    "ask_display": "$325,000",
    "ask_currency": "USD",
    "ask_value": 325000.0,